{
  "paper_id": "focused-curve-v4-1-b_kinetic_time_course_10",
  "figure_id": "figure_b_kinetic_time_course_10",
  "panel_id": "panel_b_kinetic_time_course_10",
  "panel_label": "b_kinetic_time_course_10",
  "saved_panel_image_path": "C:\\Users\\yibinjiang\\Desktop\\LSV_paper_raw_data_code\\0-to_submit\\public_submission\\ai-extracted-curve-reasoning\\benchmark_data\\benchmark_curve_extraction\\agentic_ablation\\runs\\full_single_agent_20260811\\monolithic\\replicate_01\\b_kinetic_time_course_10\\monolithic_anchor_extract\\panel_image.png",
  "saved_curve_overlay_path": "C:\\Users\\yibinjiang\\Desktop\\LSV_paper_raw_data_code\\0-to_submit\\public_submission\\ai-extracted-curve-reasoning\\benchmark_data\\benchmark_curve_extraction\\agentic_ablation\\runs\\full_single_agent_20260811\\monolithic\\replicate_01\\b_kinetic_time_course_10\\monolithic_anchor_extract\\curve_overlay.png",
  "crop_box_original": [
    0,
    0,
    1190,
    951
  ],
  "plot_area_box_cropped": [
    156,
    31,
    1129,
    813
  ],
  "panel_type": "kinetic_time_course",
  "x_axis": {
    "label": "Time",
    "units": "min",
    "tick_labels": [
      "0",
      "20",
      "40",
      "60",
      "80",
      "100",
      "120",
      "140",
      "160",
      "180"
    ],
    "chosen_model": "linear",
    "usable_for_downstream": "yes",
    "anchors": [
      {
        "tick_value": "0",
        "pixel_x": 153.5,
        "pixel_y": 814.5,
        "coordinate_system": "cropped_panel",
        "confidence": 0.99,
        "note": "Bottom-axis origin tick at the left spine."
      },
      {
        "tick_value": "20",
        "pixel_x": 262.5,
        "pixel_y": 814.5,
        "coordinate_system": "cropped_panel",
        "confidence": 0.99,
        "note": "Bottom-axis major tick."
      },
      {
        "tick_value": "40",
        "pixel_x": 370.5,
        "pixel_y": 814.5,
        "coordinate_system": "cropped_panel",
        "confidence": 0.99,
        "note": "Bottom-axis major tick."
      },
      {
        "tick_value": "60",
        "pixel_x": 479.5,
        "pixel_y": 814.5,
        "coordinate_system": "cropped_panel",
        "confidence": 0.99,
        "note": "Bottom-axis major tick."
      },
      {
        "tick_value": "80",
        "pixel_x": 587.5,
        "pixel_y": 814.5,
        "coordinate_system": "cropped_panel",
        "confidence": 0.99,
        "note": "Bottom-axis major tick."
      },
      {
        "tick_value": "100",
        "pixel_x": 696.5,
        "pixel_y": 814.5,
        "coordinate_system": "cropped_panel",
        "confidence": 0.99,
        "note": "Bottom-axis major tick."
      },
      {
        "tick_value": "120",
        "pixel_x": 804.5,
        "pixel_y": 814.5,
        "coordinate_system": "cropped_panel",
        "confidence": 0.99,
        "note": "Bottom-axis major tick."
      },
      {
        "tick_value": "140",
        "pixel_x": 913.5,
        "pixel_y": 814.5,
        "coordinate_system": "cropped_panel",
        "confidence": 0.99,
        "note": "Bottom-axis major tick."
      },
      {
        "tick_value": "160",
        "pixel_x": 1021.5,
        "pixel_y": 814.5,
        "coordinate_system": "cropped_panel",
        "confidence": 0.99,
        "note": "Bottom-axis major tick."
      },
      {
        "tick_value": "180",
        "pixel_x": 1130.5,
        "pixel_y": 814.5,
        "coordinate_system": "cropped_panel",
        "confidence": 0.99,
        "note": "Rightmost bottom-axis tick on the frame."
      }
    ],
    "fit_notes": "The axis-fit utility accepted a linear x mapping using visible ticks, with fitted slope 5.4267 px/min and intercept 153.7192 px."
  },
  "y_axis": {
    "label": "C/C0",
    "units": "",
    "tick_labels": [
      "0.0",
      "0.2",
      "0.4",
      "0.6",
      "0.8",
      "1.0"
    ],
    "chosen_model": "linear",
    "usable_for_downstream": "yes",
    "anchors": [
      {
        "tick_value": "0.0",
        "pixel_x": 153.5,
        "pixel_y": 814.5,
        "coordinate_system": "cropped_panel",
        "confidence": 0.99,
        "note": "Bottom y tick at the x-axis intersection."
      },
      {
        "tick_value": "0.2",
        "pixel_x": 153.5,
        "pixel_y": 677.5,
        "coordinate_system": "cropped_panel",
        "confidence": 0.99,
        "note": "Left-axis major tick."
      },
      {
        "tick_value": "0.4",
        "pixel_x": 153.5,
        "pixel_y": 540.5,
        "coordinate_system": "cropped_panel",
        "confidence": 0.99,
        "note": "Left-axis major tick."
      },
      {
        "tick_value": "0.6",
        "pixel_x": 153.5,
        "pixel_y": 404.5,
        "coordinate_system": "cropped_panel",
        "confidence": 0.99,
        "note": "Left-axis major tick."
      },
      {
        "tick_value": "0.8",
        "pixel_x": 153.5,
        "pixel_y": 267.5,
        "coordinate_system": "cropped_panel",
        "confidence": 0.99,
        "note": "Left-axis major tick."
      },
      {
        "tick_value": "1.0",
        "pixel_x": 153.5,
        "pixel_y": 131.5,
        "coordinate_system": "cropped_panel",
        "confidence": 0.99,
        "note": "Top labeled y tick."
      }
    ],
    "fit_notes": "The axis-fit utility accepted a linear y mapping using visible ticks, with fitted slope -682.8571 px per unit and intercept 814.3095 px."
  },
  "legend_entries": [
    "slow",
    "medium",
    "fast",
    "fastest"
  ],
  "curves": [
    {
      "curve_id": "curve_slow",
      "curve_label": "slow",
      "condition_label": "slow",
      "catalyst_context": "",
      "stroke_color": "black",
      "line_style": "solid",
      "marker_style": "open circle",
      "point_coordinate_system": "cropped_panel",
      "sampled_points": [
        {
          "pixel_x": 158.0,
          "pixel_y": 131.5,
          "confidence": 0.9
        },
        {
          "pixel_x": 172.0,
          "pixel_y": 148.0,
          "confidence": 0.92
        },
        {
          "pixel_x": 186.0,
          "pixel_y": 161.0,
          "confidence": 0.92
        },
        {
          "pixel_x": 200.0,
          "pixel_y": 179.0,
          "confidence": 0.92
        },
        {
          "pixel_x": 214.0,
          "pixel_y": 175.0,
          "confidence": 0.92
        },
        {
          "pixel_x": 228.0,
          "pixel_y": 199.0,
          "confidence": 0.92
        },
        {
          "pixel_x": 242.0,
          "pixel_y": 211.0,
          "confidence": 0.92
        },
        {
          "pixel_x": 256.0,
          "pixel_y": 228.0,
          "confidence": 0.92
        },
        {
          "pixel_x": 270.0,
          "pixel_y": 229.5,
          "confidence": 0.92
        },
        {
          "pixel_x": 284.0,
          "pixel_y": 246.0,
          "confidence": 0.92
        },
        {
          "pixel_x": 298.0,
          "pixel_y": 257.0,
          "confidence": 0.92
        },
        {
          "pixel_x": 312.0,
          "pixel_y": 265.0,
          "confidence": 0.92
        },
        {
          "pixel_x": 326.0,
          "pixel_y": 274.5,
          "confidence": 0.92
        },
        {
          "pixel_x": 340.0,
          "pixel_y": 289.0,
          "confidence": 0.92
        },
        {
          "pixel_x": 354.0,
          "pixel_y": 299.5,
          "confidence": 0.92
        },
        {
          "pixel_x": 368.0,
          "pixel_y": 304.5,
          "confidence": 0.92
        },
        {
          "pixel_x": 382.0,
          "pixel_y": 319.5,
          "confidence": 0.92
        },
        {
          "pixel_x": 396.0,
          "pixel_y": 329.0,
          "confidence": 0.92
        },
        {
          "pixel_x": 410.0,
          "pixel_y": 338.5,
          "confidence": 0.92
        },
        {
          "pixel_x": 424.0,
          "pixel_y": 341.5,
          "confidence": 0.92
        },
        {
          "pixel_x": 438.0,
          "pixel_y": 357.5,
          "confidence": 0.92
        },
        {
          "pixel_x": 452.0,
          "pixel_y": 366.5,
          "confidence": 0.92
        },
        {
          "pixel_x": 466.0,
          "pixel_y": 375.0,
          "confidence": 0.92
        },
        {
          "pixel_x": 480.0,
          "pixel_y": 375.5,
          "confidence": 0.92
        },
        {
          "pixel_x": 494.0,
          "pixel_y": 392.5,
          "confidence": 0.92
        },
        {
          "pixel_x": 512.0,
          "pixel_y": 402.5,
          "confidence": 0.92
        },
        {
          "pixel_x": 530.0,
          "pixel_y": 408.5,
          "confidence": 0.92
        },
        {
          "pixel_x": 548.0,
          "pixel_y": 423.5,
          "confidence": 0.92
        },
        {
          "pixel_x": 566.0,
          "pixel_y": 433.5,
          "confidence": 0.92
        },
        {
          "pixel_x": 584.0,
          "pixel_y": 437.5,
          "confidence": 0.92
        },
        {
          "pixel_x": 602.0,
          "pixel_y": 452.0,
          "confidence": 0.92
        },
        {
          "pixel_x": 620.0,
          "pixel_y": 461.5,
          "confidence": 0.92
        },
        {
          "pixel_x": 638.0,
          "pixel_y": 466.0,
          "confidence": 0.92
        },
        {
          "pixel_x": 656.0,
          "pixel_y": 478.5,
          "confidence": 0.92
        },
        {
          "pixel_x": 674.0,
          "pixel_y": 487.5,
          "confidence": 0.92
        },
        {
          "pixel_x": 692.0,
          "pixel_y": 491.0,
          "confidence": 0.92
        },
        {
          "pixel_x": 710.0,
          "pixel_y": 503.5,
          "confidence": 0.92
        },
        {
          "pixel_x": 728.0,
          "pixel_y": 511.5,
          "confidence": 0.92
        },
        {
          "pixel_x": 746.0,
          "pixel_y": 514.0,
          "confidence": 0.92
        },
        {
          "pixel_x": 764.0,
          "pixel_y": 526.5,